{
    "$schema": "http://json-schema.org/draft-07/schema#",
    "title": "Resume Content Schema",
    "type": "object",
    "required": [
        "personalInfo",
        "workExperience",
        "education",
        "skills"
    ],
    "properties": {
        "personalInfo": {
            "type": "object",
            "required": [
                "name",
                "email",
                "phone"
            ],
            "properties": {
                "name": {
                    "type": "string"
                },
                "email": {
                    "type": "string",
                    "format": "email"
                },
                "phone": {
                    "type": "string"
                },
                "location": {
                    "type": "string"
                },
                "linkedin": {
                    "type": "string"
                },
                "github": {
                    "type": "string"
                },
                "website": {
                    "type": "string"
                }
            }
        },
        "summary": {
            "type": "string",
            "description": "Professional summary (can be AI-generated)"
        },
        "workExperience": {
            "type": "array",
            "minItems": 1,
            "items": {
                "type": "object",
                "required": [
                    "id",
                    "company",
                    "role",
                    "startDate",
                    "achievements"
                ],
                "properties": {
                    "id": {
                        "type": "string"
                    },
                    "company": {
                        "type": "string"
                    },
                    "role": {
                        "type": "string"
                    },
                    "startDate": {
                        "type": "string"
                    },
                    "endDate": {
                        "type": "string"
                    },
                    "location": {
                        "type": "string"
                    },
                    "achievements": {
                        "type": "array",
                        "items": {
                            "type": "string"
                        }
                    }
                }
            }
        },
        "education": {
            "type": "array",
            "minItems": 1,
            "items": {
                "type": "object",
                "required": [
                    "id",
                    "degree",
                    "institution",
                    "startDate",
                    "endDate"
                ],
                "properties": {
                    "id": {
                        "type": "string"
                    },
                    "degree": {
                        "type": "string"
                    },
                    "institution": {
                        "type": "string"
                    },
                    "location": {
                        "type": "string"
                    },
                    "startDate": {
                        "type": "string"
                    },
                    "endDate": {
                        "type": "string"
                    },
                    "gpa": {
                        "type": "string"
                    },
                    "honors": {
                        "type": "string"
                    }
                }
            }
        },
        "skills": {
            "type": "array",
            "minItems": 1,
            "items": {
                "type": "object",
                "required": [
                    "category",
                    "items"
                ],
                "properties": {
                    "category": {
                        "type": "string"
                    },
                    "items": {
                        "type": "array",
                        "items": {
                            "type": "string"
                        }
                    }
                }
            }
        },
        "projects": {
            "type": "array",
            "items": {
                "type": "object",
                "required": [
                    "id",
                    "name",
                    "description"
                ],
                "properties": {
                    "id": {
                        "type": "string"
                    },
                    "name": {
                        "type": "string"
                    },
                    "description": {
                        "type": "string"
                    },
                    "technologies": {
                        "type": "array",
                        "items": {
                            "type": "string"
                        }
                    },
                    "link": {
                        "type": "string"
                    },
                    "highlights": {
                        "type": "array",
                        "items": {
                            "type": "string"
                        }
                    }
                }
            }
        },
        "certifications": {
            "type": "array",
            "items": {
                "type": "object",
                "required": [
                    "id",
                    "name",
                    "issuer",
                    "date"
                ],
                "properties": {
                    "id": {
                        "type": "string"
                    },
                    "name": {
                        "type": "string"
                    },
                    "issuer": {
                        "type": "string"
                    },
                    "date": {
                        "type": "string"
                    },
                    "link": {
                        "type": "string"
                    }
                }
            }
        },
        "achievements": {
            "type": "array",
            "items": {
                "type": "string"
            },
            "description": "Overall key achievements (can be AI-generated)"
        }
    }
}